{"password": "", "recover": false, "output_path": "/storage/emulated/0/encv-output", "plugin_settings": {}, "server": {"port": 2025, "dir": "/storage/emulated/0"}, "admin": {"port": 18080, "password": ""}, "webdav": {"port": 12340, "root": "/webdav/", "dir": "", "username": "", "password": ""}, "proxy": {"sites": {}, "disable_signature_verification": true}, "log": {"level": "debug", "file": "", "console": true}}